{
  "$schema": "./marketplace.schema.json",
  "version": 1,
  "repo": "holaboss-ai/holaboss-apps",
  "default_ref": "v0.3.1",
  "archive_url_template": "https://github.com/holaboss-ai/holaboss-apps/releases/download/{ref}/{name}-module-{target}.tar.gz",
  "apps": [
    {
      "name": "twitter",
      "description": "Compose, schedule, and publish tweets. Manages drafts locally and queues sends through the platform.",
      "icon": "twitter",
      "category": "social",
      "tags": [
        "social",
        "content",
        "publishing",
        "twitter",
        "x"
      ],
      "path": "twitter",
      "provider_id": "twitter",
      "credential_source": "platform",
      "default_ref": "twitter@0.3.0",
      "is_hidden": false,
      "is_coming_soon": false
    },
    {
      "name": "linkedin",
      "description": "Compose, schedule, and publish LinkedIn posts (up to 3,000 chars). Drafts → queue → publish lifecycle.",
      "icon": "linkedin",
      "category": "social",
      "tags": [
        "social",
        "content",
        "publishing",
        "linkedin",
        "professional"
      ],
      "path": "linkedin",
      "provider_id": "linkedin",
      "credential_source": "platform",
      "is_hidden": false,
      "is_coming_soon": false
    },
    {
      "name": "reddit",
      "description": "Compose and submit Reddit text posts to specific subreddits, with title + Markdown body and scheduled-publish support.",
      "icon": "reddit",
      "category": "social",
      "tags": [
        "social",
        "content",
        "publishing",
        "reddit",
        "community"
      ],
      "path": "reddit",
      "provider_id": "reddit",
      "credential_source": "platform",
      "is_hidden": false,
      "is_coming_soon": false
    },
    {
      "name": "gmail",
      "description": "Search Gmail threads, draft replies locally, and send via the Gmail API. Pin threads as workspace outputs for CRM follow-up.",
      "icon": "gmail",
      "category": "productivity",
      "tags": [
        "email",
        "productivity",
        "google",
        "communication",
        "crm"
      ],
      "path": "gmail",
      "provider_id": "gmail",
      "credential_source": "platform",
      "is_hidden": false,
      "is_coming_soon": false
    },
    {
      "name": "github",
      "description": "Read-only GitHub digests — recent commits, PRs, releases, and repo activity windows.",
      "icon": "github",
      "category": "productivity",
      "tags": [
        "development",
        "git",
        "code",
        "productivity",
        "engineering"
      ],
      "path": "github",
      "provider_id": "github",
      "credential_source": "platform",
      "is_hidden": false,
      "is_coming_soon": false
    },
    {
      "name": "sheets",
      "description": "Google Sheets CRUD — read rows by header, append, update by row, with auto-publish of contact-row outputs for CRM workflows.",
      "icon": "google-sheets",
      "category": "productivity",
      "tags": [
        "spreadsheet",
        "data",
        "google",
        "productivity",
        "crm"
      ],
      "path": "sheets",
      "provider_id": "googlesheets",
      "credential_source": "platform",
      "is_hidden": false,
      "is_coming_soon": false
    },
    {
      "name": "calcom",
      "description": "Cal.com event types, bookings, availability, reschedule, and cancel — surfaced through the agent's tool catalog.",
      "icon": "cal",
      "category": "productivity",
      "tags": [
        "scheduling",
        "meetings",
        "productivity",
        "calendar"
      ],
      "path": "calcom",
      "provider_id": "cal",
      "credential_source": "platform",
      "is_hidden": false,
      "is_coming_soon": false
    },
    {
      "name": "attio",
      "description": "Attio CRM — find / create / update people and companies with dynamic schema discovery; add notes, tasks, and pipeline stages.",
      "icon": "attio",
      "category": "crm",
      "tags": [
        "crm",
        "contacts",
        "sales",
        "pipeline",
        "b2b"
      ],
      "path": "attio",
      "provider_id": "attio",
      "credential_source": "platform",
      "is_hidden": false,
      "is_coming_soon": false
    },
    {
      "name": "apollo",
      "description": "Apollo.io prospecting — search people / organizations, enrich emails, and orchestrate outbound email sequences.",
      "icon": "apollo",
      "category": "crm",
      "tags": [
        "sales",
        "prospecting",
        "outreach",
        "b2b",
        "email"
      ],
      "path": "apollo",
      "provider_id": "apollo",
      "credential_source": "platform",
      "default_ref": "apollo@0.3.1",
      "is_hidden": false,
      "is_coming_soon": false
    },
    {
      "name": "zoominfo",
      "description": "ZoomInfo B2B intelligence — search contacts and companies, fetch firmographics + intent signals, inspect org charts.",
      "icon": "zoominfo",
      "category": "crm",
      "tags": [
        "sales",
        "data",
        "intelligence",
        "b2b",
        "prospecting"
      ],
      "path": "zoominfo",
      "provider_id": "zoominfo",
      "credential_source": "platform",
      "is_hidden": false,
      "is_coming_soon": false
    },
    {
      "name": "instantly",
      "description": "Instantly cold email — manage campaigns, leads, and stats; idempotent pause / resume for in-flight outbound.",
      "icon": "instantly",
      "category": "crm",
      "tags": [
        "sales",
        "email",
        "outreach",
        "automation",
        "b2b"
      ],
      "path": "instantly",
      "provider_id": "instantly",
      "credential_source": "platform",
      "is_hidden": false,
      "is_coming_soon": false
    },
    {
      "name": "hubspot",
      "description": "HubSpot CRM — contacts, companies, deals with dynamic property discovery; pipelines + stages enforced; notes and tasks.",
      "icon": "hubspot",
      "category": "crm",
      "tags": [
        "crm",
        "sales",
        "marketing",
        "contacts",
        "deals",
        "b2b"
      ],
      "path": "hubspot",
      "provider_id": "hubspot",
      "credential_source": "platform",
      "is_hidden": false,
      "is_coming_soon": false
    }
  ]
}
